[
  {
    "acceptable_node_ids": [
      "80ff781d-9b55-5af8-8b3b-ee7bc90c732c"
    ],
    "acceptable_policy_statuses": [
      "AMBIGUOUS"
    ],
    "acceptable_profiles": [
      {
        "cardinality": "SINGLE",
        "node_kind": "PROPERTY",
        "value_type": "time_code"
      }
    ],
    "acceptable_terminals": [
      {
        "action": "SELECT_CANDIDATE",
        "target_disposition": "FOUND_TOP8",
        "target_node_id": "80ff781d-9b55-5af8-8b3b-ee7bc90c732c"
      },
      {
        "action": "SELECT_OUTSIDE_CANDIDATE",
        "target_disposition": "FOUND_OUTSIDE",
        "target_node_id": "80ff781d-9b55-5af8-8b3b-ee7bc90c732c"
      }
    ],
    "assessment_authority": "CODEX_ASSISTED",
    "category": "CLARIFICATION",
    "clarification_policy": "CLARIFICATION_REQUIRED",
    "execution_eligible": true,
    "expected_route": "CLARIFY",
    "forbidden_node_ids": [
      "8639f130-6b9b-506d-bfe6-49787e79daeb"
    ],
    "frozen_clarification_answer": "是晨光幕布开始投射的时间。",
    "gold_eligible": false,
    "oracle_hash": "4a147334200bcf028a56ab41ed6cd4922c557f208d01ee1a1403c7e57b98815b",
    "patch_eligible": false,
    "quality_tier": "SILVER",
    "request_digest": "89bb68d6444e854ca73527950b75ea958dd1c941013d26370b263653f3873d17",
    "review_status": "CODEX_SILVER_REVIEWED",
    "reviewed_bytes_digest": "88417b25c29265ae93faee9467adcec72f115703b389ed156292e5b9dd6b5f0a",
    "scenario_ref": "v3c-b02-cla-01",
    "schema_version": "navigation-copilot-sealed-oracle.v2",
    "target_status": "TARGET_PRESENT",
    "tree_digest": "0fd913307cbeed08c78605c1acbcbad861df64a2b3502550896e2bf4dce39846",
    "wrong_context_challenge": false
  },
  {
    "acceptable_node_ids": [
      "0ecd305f-c88f-50a8-a3f2-679ed5b90e2a"
    ],
    "acceptable_policy_statuses": [
      "AMBIGUOUS"
    ],
    "acceptable_profiles": [
      {
        "cardinality": "SINGLE",
        "node_kind": "PROPERTY",
        "value_type": "space_code"
      }
    ],
    "acceptable_terminals": [
      {
        "action": "SELECT_OUTSIDE_CANDIDATE",
        "target_disposition": "FOUND_OUTSIDE",
        "target_node_id": "0ecd305f-c88f-50a8-a3f2-679ed5b90e2a"
      },
      {
        "action": "SELECT_CANDIDATE",
        "target_disposition": "FOUND_TOP8",
        "target_node_id": "0ecd305f-c88f-50a8-a3f2-679ed5b90e2a"
      }
    ],
    "assessment_authority": "CODEX_ASSISTED",
    "category": "CLARIFICATION",
    "clarification_policy": "CLARIFICATION_REQUIRED",
    "execution_eligible": true,
    "expected_route": "CLARIFY",
    "forbidden_node_ids": [
      "2be10c49-2450-5a98-8485-3bfda3a56576"
    ],
    "frozen_clarification_answer": "我需要低刺激入口，不是桥下声廊入口。",
    "gold_eligible": false,
    "oracle_hash": "90b9751695e362e80343bfb362f49555c22d096437e9d98b6a64a2ec58682105",
    "patch_eligible": false,
    "quality_tier": "SILVER",
    "request_digest": "5d9c8dda197467a029ec437464edcfb2fe7ca7a50f4cf01a4158a951fc618a31",
    "review_status": "CODEX_SILVER_REVIEWED",
    "reviewed_bytes_digest": "07b87a30266185642ade2388009735d284d1c86fb81c133112d937c130aa562c",
    "scenario_ref": "v3c-b02-cla-02",
    "schema_version": "navigation-copilot-sealed-oracle.v2",
    "target_status": "TARGET_PRESENT",
    "tree_digest": "0fd913307cbeed08c78605c1acbcbad861df64a2b3502550896e2bf4dce39846",
    "wrong_context_challenge": true
  },
  {
    "acceptable_node_ids": [
      "e4575d6f-7c7d-59c0-9a2a-99cd88634553"
    ],
    "acceptable_policy_statuses": [
      "AMBIGUOUS"
    ],
    "acceptable_profiles": [
      {
        "cardinality": "SINGLE",
        "node_kind": "PROPERTY",
        "value_type": "time_code"
      }
    ],
    "acceptable_terminals": [
      {
        "action": "SELECT_CANDIDATE",
        "target_disposition": "FOUND_TOP8",
        "target_node_id": "e4575d6f-7c7d-59c0-9a2a-99cd88634553"
      },
      {
        "action": "SELECT_OUTSIDE_CANDIDATE",
        "target_disposition": "FOUND_OUTSIDE",
        "target_node_id": "e4575d6f-7c7d-59c0-9a2a-99cd88634553"
      }
    ],
    "assessment_authority": "CODEX_ASSISTED",
    "category": "CLARIFICATION",
    "clarification_policy": "CLARIFICATION_REQUIRED",
    "execution_eligible": true,
    "expected_route": "CLARIFY",
    "forbidden_node_ids": [
      "914bb873-9a5c-5add-a391-48845d2b64b7"
    ],
    "frozen_clarification_answer": "看每天第一班，不是最后一班。",
    "gold_eligible": false,
    "oracle_hash": "cf66b23c55e1a08eecdbe779aa0f49df47c8b177392dbc8f24b3ef9dc8aa8c59",
    "patch_eligible": false,
    "quality_tier": "SILVER",
    "request_digest": "ed9291fd7d40be6b415b380aeba4653466d468b2be4e8a120cdf4b3f8ba8d5fd",
    "review_status": "CODEX_SILVER_REVIEWED",
    "reviewed_bytes_digest": "fe3ba16b0970f02a18a574cd9594c59e23ecd63f64a8e765f780f29619098ba7",
    "scenario_ref": "v3c-b02-cla-03",
    "schema_version": "navigation-copilot-sealed-oracle.v2",
    "target_status": "TARGET_PRESENT",
    "tree_digest": "0fd913307cbeed08c78605c1acbcbad861df64a2b3502550896e2bf4dce39846",
    "wrong_context_challenge": false
  },
  {
    "acceptable_node_ids": [
      "3ab54720-a960-5e17-bfe0-951572da0fca"
    ],
    "acceptable_policy_statuses": [
      "AMBIGUOUS"
    ],
    "acceptable_profiles": [
      {
        "cardinality": "SINGLE",
        "node_kind": "PROPERTY",
        "value_type": "boolean"
      }
    ],
    "acceptable_terminals": [
      {
        "action": "SELECT_OUTSIDE_CANDIDATE",
        "target_disposition": "FOUND_OUTSIDE",
        "target_node_id": "3ab54720-a960-5e17-bfe0-951572da0fca"
      },
      {
        "action": "SELECT_CANDIDATE",
        "target_disposition": "FOUND_TOP8",
        "target_node_id": "3ab54720-a960-5e17-bfe0-951572da0fca"
      }
    ],
    "assessment_authority": "CODEX_ASSISTED",
    "category": "CLARIFICATION",
    "clarification_policy": "CLARIFICATION_REQUIRED",
    "execution_eligible": true,
    "expected_route": "CLARIFY",
    "forbidden_node_ids": [
      "2f83ab4d-7e04-56af-84bb-83ce7008f5be"
    ],
    "frozen_clarification_answer": "看日常共厨服务，不是节庆供餐。",
    "gold_eligible": false,
    "oracle_hash": "d67f1e4c2b61c0e2f41453d718bd29833cba10abbcf12dc3b3ce853df0d48067",
    "patch_eligible": false,
    "quality_tier": "SILVER",
    "request_digest": "32b8e9ec8c21c750cce667615b72e259119107498ae70848b455f94f30ac0478",
    "review_status": "CODEX_SILVER_REVIEWED",
    "reviewed_bytes_digest": "2c9441d43a39902d54fdab986e12442f94a64c0994b7e715b27190157ec9e12a",
    "scenario_ref": "v3c-b02-cla-04",
    "schema_version": "navigation-copilot-sealed-oracle.v2",
    "target_status": "TARGET_PRESENT",
    "tree_digest": "0fd913307cbeed08c78605c1acbcbad861df64a2b3502550896e2bf4dce39846",
    "wrong_context_challenge": false
  },
  {
    "acceptable_node_ids": [
      "0a640f1e-2531-5d2c-94f1-480bdbb52ac7"
    ],
    "acceptable_policy_statuses": [
      "AMBIGUOUS"
    ],
    "acceptable_profiles": [
      {
        "cardinality": "SINGLE",
        "node_kind": "PROPERTY",
        "value_type": "time_code"
      }
    ],
    "acceptable_terminals": [
      {
        "action": "SELECT_CANDIDATE",
        "target_disposition": "FOUND_TOP8",
        "target_node_id": "0a640f1e-2531-5d2c-94f1-480bdbb52ac7"
      },
      {
        "action": "SELECT_OUTSIDE_CANDIDATE",
        "target_disposition": "FOUND_OUTSIDE",
        "target_node_id": "0a640f1e-2531-5d2c-94f1-480bdbb52ac7"
      }
    ],
    "assessment_authority": "CODEX_ASSISTED",
    "category": "CLARIFICATION",
    "clarification_policy": "CLARIFICATION_REQUIRED",
    "execution_eligible": true,
    "expected_route": "CLARIFY",
    "forbidden_node_ids": [
      "22b85f46-c287-5444-b8c2-2df23b732715"
    ],
    "frozen_clarification_answer": "是织物缝补完成的时间，不是轮车修缮。",
    "gold_eligible": false,
    "oracle_hash": "1fc852e8e248ae9ccad103a08b4e331a970f3d1038daf7fde3459cc4f60faea0",
    "patch_eligible": false,
    "quality_tier": "SILVER",
    "request_digest": "4e175a889fa20ef103cc7a54274617a3010c270edcb328babf5309e13de38ec9",
    "review_status": "CODEX_SILVER_REVIEWED",
    "reviewed_bytes_digest": "a1a1c12cb51b645811dca46d08a909e2c12a6db62ca42bf51ec04fcccd7746a6",
    "scenario_ref": "v3c-b02-cla-05",
    "schema_version": "navigation-copilot-sealed-oracle.v2",
    "target_status": "TARGET_PRESENT",
    "tree_digest": "0fd913307cbeed08c78605c1acbcbad861df64a2b3502550896e2bf4dce39846",
    "wrong_context_challenge": true
  },
  {
    "acceptable_node_ids": [
      "84df972e-48b9-5697-9723-9d84072529e4"
    ],
    "acceptable_policy_statuses": [
      "AMBIGUOUS"
    ],
    "acceptable_profiles": [
      {
        "cardinality": "MULTIPLE",
        "node_kind": "PROPERTY",
        "value_type": "time_code"
      }
    ],
    "acceptable_terminals": [
      {
        "action": "SELECT_OUTSIDE_CANDIDATE",
        "target_disposition": "FOUND_OUTSIDE",
        "target_node_id": "84df972e-48b9-5697-9723-9d84072529e4"
      },
      {
        "action": "SELECT_CANDIDATE",
        "target_disposition": "FOUND_TOP8",
        "target_node_id": "84df972e-48b9-5697-9723-9d84072529e4"
      }
    ],
    "assessment_authority": "CODEX_ASSISTED",
    "category": "CLARIFICATION",
    "clarification_policy": "CLARIFICATION_REQUIRED",
    "execution_eligible": true,
    "expected_route": "CLARIFY",
    "forbidden_node_ids": [
      "e8f9a08c-3e96-54f8-8033-b8f6829927a5"
    ],
    "frozen_clarification_answer": "是潮声观察席的开放时窗。",
    "gold_eligible": false,
    "oracle_hash": "27f295ae593b2ad8e82281e10abf828ae98c0ab6b45da32ed97af9066c522213",
    "patch_eligible": false,
    "quality_tier": "SILVER",
    "request_digest": "4d5e0adf93181368a2fbd9d39a1db6525ff910e4a27f765e6bf334234d67d59e",
    "review_status": "CODEX_SILVER_REVIEWED",
    "reviewed_bytes_digest": "6af0e4c1e8bb3ffcebb58abd4e147198cee351555b47efe2594a971666cfe040",
    "scenario_ref": "v3c-b02-cla-06",
    "schema_version": "navigation-copilot-sealed-oracle.v2",
    "target_status": "TARGET_PRESENT",